scotus_filename,title,holding,decision_date,
https://www.supremecourt.gov/opinions/22pdf/145orig_kjfl.pdf,Delaware v. Pennsylvania,"Recommendations in the Special Master’s First Interim Report concluding that the escheatment of certain financial instruments relevant to this case should follow the Federal Disposition Act are adopted to the extent they are consistent with the Court’s opinion, and Delaware’s objections are overruled.",02/28/2023,
https://www.supremecourt.gov/opinions/22pdf/21-1195_h3ci.pdf,Bittner v. United States,"The Bank Secrecy Act’s $10,000 maximum penalty for the nonwillful failure to file a compliant report accrues on a per-report, not a per-account, basis.",02/28/2023,
https://www.supremecourt.gov/opinions/22pdf/21-908_n6io.pdf,Bartenwerfer v. Buckley,"Pursuant to §523(a)(2)(A) of the Bankruptcy Code, a debtor like Kate Bartenwerfer who is liable for her partner’s fraud cannot discharge that debt in bankruptcy, regardless of her own culpability.",02/22/2023,
https://www.supremecourt.gov/opinions/22pdf/21-984_j426.pdf,"Helix Energy Solutions Group, Inc. v. Hewitt","Respondent Hewitt was not an executive exempt from the FLSA’s overtime pay guarantee; daily-rate workers, of whatever income level, qualify as paid on a salary basis only if the conditions set out in 29 CFR §541.604(b) are met.",02/22/2023,
https://www.supremecourt.gov/opinions/22pdf/21-846_lkgn.pdf,Cruz v. Arizona,"The Arizona Supreme Court’s holding below—that Lynch v. Arizona, 578 U. S. 613, did not represent a “significant change in the law” for purposes of permitting Cruz to file a successive petition for state postconviction relief under Arizona Rule of Criminal Procedure 32.1(g)—is not an adequate state-law ground supporting that judgment.",02/22/2023,
https://www.supremecourt.gov/opinions/22pdf/21-1397_ap6b.pdf,In re Grand Jury,Certiorari dismissed as improvidently granted.,01/23/2023,
https://www.supremecourt.gov/opinions/22pdf/21-432_f2bh.pdf,Arellano v. McDonough,The effective date of an award of service-related disability compensation to a veteran of the United States military  determined pursuant to 38 U. S. C. §§5110(a)(1) and 5110(b)(1) is not subject to equitable tolling.,01/23/2023,
